{
  "eventId": "0190f2a0-0000-7000-8000-000000000013",
  "aggregateId": "0190f2a0-0000-7000-8000-000000000113",
  "occurredAt": "2026-08-13T10:00:00Z",
  "version": 1,
  "clubId": "0190f2a0-0000-7000-8000-00000000c1b0",
  "actorId": "0190f2a0-0000-7000-8000-0000000000ac",
  "traceparent": "00-0af7651916cd43dd8448eb211c80319c-b7ad6b7169203331-01",
  "grupoId": "0190f2a0-0000-7000-8000-000000000201",
  "sesionId": "0190f2a0-0000-7000-8000-000000000401",
  "dia": "2026-08-17",
  "alumnoId": "0190f2a0-0000-7000-8000-000000000301",
  "override": {
    "tipo": "TEMPO",
    "volumenTipo": "DISTANCIA",
    "volumenMetros": 8000,
    "volumenMinutos": null,
    "ritmoTipo": "RELATIVO",
    "ritmoSegundosPorKm": null,
    "ritmoReferencia": "10K",
    "ritmoDeltaSegundosPorKm": 15,
    "notas": "Calentar 15 minutos antes"
  },
  "mensajeAlAlumno": "Hoy un poco más suave"
}
